{
  "schemaVersion": 1,
  "version": "0.1.0-rc.1",
  "source": {
    "commit": "94ba6b257fbfd16b2e35bc0117a8afa55a4d55e1",
    "dirty": false,
    "sha256": "e1d69369d5ad7b35de72af6b677f83b0583a298d94d539a65c8e2aacc9001876"
  },
  "archiveSha256": "db60c071e8cdde2d3f8eac43c465c14371aafa6ed038c29b3c7944ac75ecb3f1",
  "checks": [
    "Apache-2.0 package and Go module licenses",
    "manifest integrity",
    "reproducible archive",
    "stale staging cleanup",
    "tampered manifest rejection",
    "unexpected file rejection",
    "external npm-layout TypeScript declarations",
    "external npm-layout Deno direct/replay/worker",
    "external Go compile/replay",
    "public pinned wazero without replacement",
    "cross-SDK generated-byte parity"
  ],
  "generated": {
    "request": "43699a14e8a33df5b78c973f1a9fa7de7bcf6e41330e04733ab8269c961c3f9f",
    "cpp/candidate.capnp.h": "f72919e6b83511a7de03d718d11a4a378cf26c4601925a06984cdcad9a7d234d",
    "cpp/candidate.capnp.c++": "69b1a70a77853e60ec575d5efc9c48cb8bc91effeb6939bffbf37f6b71297be1",
    "rust/candidate_capnp.rs": "360678717468e8e4bac0be2d56c623b4e77c979e77641c7af188da19a281bd73",
    "go/candidate.capnp.go": "b2cd45497d411ffecd2bf9517a4b9a98c6fc963f7316dccab1b9a778b0a910a0",
    "zig/candidate.zig": "e17bd69ac0340e61cc30868d3b0faa8d07ac40b05aa2a3068b151caf1270d9f1"
  }
}
